{
  "quoteId": "q-seed-acme-7",
  "version": 1,
  "internal": {
    "quoteId": "q-seed-acme-7",
    "version": 1,
    "request": {
      "requestId": "req-seed-001",
      "dealId": "DEAL-ACME-001",
      "accountId": "ACME-7",
      "actor": {
        "userId": "u-dana",
        "role": "manager",
        "accountIds": ["ACME-7", "NORTHWIND-2"]
      },
      "sku": "DDX-RACK-100",
      "quantity": 100,
      "deliveryStart": "2026-11-01",
      "deliveryEnd": "2026-11-15",
      "destination": "6 sites across US",
      "scopeLocations": 6,
      "termMonths": 12,
      "paymentTerms": "Net 30",
      "proposedDiscountPct": "15.00",
      "currency": "USD",
      "quoteExpiry": "2026-12-01"
    },
    "economics": {
      "currency": "USD",
      "listPrice": "160000.00",
      "totalContractValue": "136000.00",
      "upfront": "112000.00",
      "recurring": "24000.00",
      "discountPct": "15.00",
      "costs": [
        { "label": "Hardware, 100 units",     "expected": "60000.00", "stress": "66000.00", "unit": "USD" },
        { "label": "Freight, two shipments",  "expected": "2000.00",  "stress": "2400.00",  "unit": "USD" },
        { "label": "Installation",            "expected": "4000.00",  "stress": "4000.00",  "unit": "USD" },
        { "label": "Service, twelve months",  "expected": "24000.00", "stress": "25200.00", "unit": "USD" }
      ],
      "baseCostTotal": "90000.00",
      "stressCostTotal": "97600.00",
      "grossMargin": "33.82",
      "stressMargin": "28.24",
      "marginFloor": "25.00",
      "minAcceptablePrice": "130133.34",
      "recommendedPrice": "144000.00",
      "feasibleRange": { "low": "130133.34", "high": "160000.00" },
      "warnings": [
        { "code": "EXCEEDS_REP_AUTHORITY", "message": "A 15% discount exceeds the 10% rep limit and requires director approval.", "severity": "warn" }
      ],
      "assumptions": [
        "Taxes, FX, financing, returns, and working-capital effects are excluded.",
        "Twelve-month service term, one known payment schedule, USD only."
      ],
      "dataVersion": "feed-2026-10-25-a"
    },
    "evidence": [
      {
        "docId": "acme-profile",
        "docHash": "d0c1",
        "docTitle": "ACME Industrial Account Profile",
        "section": "Deployment Sites",
        "page": null,
        "passage": "ACME operates across 6 primary industrial locations requiring multi-site rollout.",
        "effectiveDate": "2026-09-14",
        "classification": "internal",
        "rank": 1,
        "reason": "Deployment Sites"
      }
    ],
    "approval": {
      "state": "pending",
      "actor": null,
      "authority": null,
      "exception": null,
      "expiresAt": null,
      "quoteHash": "SEED"
    },
    "policyVersion": "v1",
    "forecastVersion": "seed"
  },
  "customer": {
    "currency": "USD",
    "totalContractValue": "136000.00",
    "upfront": "112000.00",
    "recurring": "24000.00",
    "quoteExpiry": "2026-12-01",
    "scopeLocations": 6,
    "termMonths": 12,
    "destination": "6 sites across US",
    "explanation": "This offer includes deployment at 6 locations and 12 months of managed support. The quoted price is valid through 2026-12-01; a phased deployment option can reduce the initial commitment."
  }
}
